{
  "$schema": "./v1-cli-surface.schema.json",
  "schemaVersion": 1,
  "sourceVersion": "0.1.0",
  "commands": [
    "create",
    "init",
    "upgrade",
    "add",
    "sync",
    "status",
    "check",
    "doctor",
    "version",
    "help"
  ],
  "options": [
    "cwd",
    "json",
    "yes",
    "ci",
    "dry-run",
    "force",
    "no-install",
    "runtime",
    "quiet",
    "debug",
    "version",
    "help",
    "h",
    "kind",
    "check",
    "mode",
    "framework",
    "billing",
    "features",
    "database",
    "apps",
    "preset",
    "cache",
    "stack",
    "with-auth",
    "with-api",
    "with-email",
    "with-analytics",
    "with-cache",
    "with-eve",
    "with-i18n",
    "with-pdf",
    "with-messaging",
    "fix",
    "verbose",
    "list"
  ],
  "exitCodes": {
    "OK": 0,
    "GENERAL_ERROR": 1,
    "INVALID_ARGUMENTS": 2,
    "DRIFT": 8,
    "CANCELLED": 130,
    "MISSING_DEPENDENCY": 16,
    "VALIDATION_ERROR": 17,
    "CONFLICT_ERROR": 18,
    "LOCK_ERROR": 19,
    "GIT_DIRTY_ERROR": 20,
    "INCOMPATIBLE_SCHEMA": 21,
    "GENERATION_ERROR": 22,
    "INVALID_STATE": 23
  },
  "capabilities": {
    "modes": ["monorepo", "single"],
    "frameworks": ["nextjs", "tanstack-start"],
    "apps": ["web", "mobile", "desktop"],
    "databases": ["postgres", "convex", "none"],
    "billingProviders": ["stripe", "chargily", "paddle", "polar"],
    "features": ["eve", "i18n"],
    "presets": ["saas", "frontend", "custom"],
    "cacheProviders": ["redis", "none"],
    "deployTargets": ["vercel", "fly", "docker", "none"],
    "stacks": ["nextjs", "tanstack-start", "expo", "both"]
  }
}
